{
  "$schema": "http://json-schema.org/draft-07/schema#",
  "title": "svg-prompt entry meta",
  "description": "gallery/<category>/<entry>/meta.json 的校验规则。五维标签：space(空间) × time(时间) + category(目录即分类) + difficulty(难度 L1-L6) + spellLevel(咒语等级 L1-L3)。",
  "type": "object",
  "required": ["slug", "title", "space", "time", "difficulty", "spellLevel", "description"],
  "properties": {
    "slug": {
      "type": "string",
      "pattern": "^[a-z0-9]+(-[a-z0-9]+)*$",
      "description": "英文 kebab-case 条目名，必须与所在目录名一致"
    },
    "title": {
      "type": "string",
      "description": "中文标题"
    },
    "space": {
      "enum": ["2d", "3d"],
      "description": "空间维度：是否使用三维投影/光照/拓扑变换"
    },
    "time": {
      "enum": ["static", "smil", "css", "js"],
      "description": "时间维度：static 静态 / smil 内嵌动画（零依赖） / css 动画 / js 驱动动画"
    },
    "difficulty": {
      "type": "integer",
      "minimum": 1,
      "maximum": 6,
      "description": "实现难度 L1(基础形状) 至 L6(拓扑形变/系统级)"
    },
    "spellLevel": {
      "type": "integer",
      "minimum": 1,
      "maximum": 3,
      "description": "咒语等级：L1 一句话直出 / L2 结构化模板 / L3 系统化流水线"
    },
    "tech": {
      "type": "array",
      "items": { "type": "string" },
      "description": "用到的技术标签，如 path / feTurbulence / mask / textPath"
    },
    "description": {
      "type": "string",
      "description": "一句话描述"
    },
    "author": {
      "type": "string",
      "description": "GitHub 用户名"
    },
    "date": {
      "type": "string",
      "format": "date",
      "description": "收录日期 YYYY-MM-DD"
    }
  },
  "additionalProperties": false
}
