{
  "slug": "dashboard",
  "title": "数据可视化仪表盘",
  "space": "2d",
  "time": "smil",
  "difficulty": 4,
  "spellLevel": 2,
  "tech": ["linearGradient", "stroke-dasharray", "animate", "rect", "text"],
  "description": "KPI 卡 + 面积折线图 + 环形进度 + 条形图，打开文件的一瞬间数据流入动画自动播放",
  "author": "airay1015",
  "date": "2026-10-07"
}
